{
  "name": "demir-bot-pilot",
  "version": "0.1.1",
  "description": "Private skills-only pilot of the Demir Bot coordinator and 26 specialist skills.",
  "author": {
    "name": "Local developer"
  },
  "skills": "./skills/",
  "interface": {
    "displayName": "Demir Bot \u2014 Private Pilot",
    "shortDescription": "Personal workflow coordinator",
    "longDescription": "Private local pilot. Includes 27 instruction skills and retained upstream notices. Personal facts, voice calibration, accounts, credentials, private publisher runtime and backups are excluded. Optional local helper and check source is bundled; execution is opt-in. External plugins are optional and require their own installation, access and action authorization. No background service or automatic testing. Not reviewed for public redistribution.",
    "developerName": "Local developer",
    "category": "Productivity",
    "capabilities": [],
    "defaultPrompt": "Use $demir-bot-pilot:demir-bot for this task, preserving my scope and opt-in testing preferences."
  }
}
